regname,eotype,areaname,eoname,eolevel,eosize,teachstuff,nonteachstuff,teachstuffretage,pupils,pupilswithpreschool,classes,opex,opexplan,hub,budgetcode,ownership,DISO,EDRPOU,year,KOATUU_2020_reg,EDRPOU_checked,id
Вінницька область,місто,Жмеринська міська ОТГ,"Загальноосвітня школа І-ІІІ ступенів №1 комунальної власності територіальної громади міста Жмеринки Вінницької області_x000D_
",I-III,,44,20,8,539,539,20,9915.2,11123,ні,2202100000,комунальна,8173,26244113,2019,05,26244113,загальноосвтняшкола3ступ1комунальнавласностмжмеринкивницькаоблх000
Вінницька область,місто,Жмеринська міська ОТГ,Загальноосвітня школа I-III ступенів №4 комунальної властності теріторіальної громади міста Жмеринки Вінницької області,I-III,,61,22,6,854,854,32,14321.9,14598.6,ні,2202100000,комунальна,8176,26244099,2019,05,26244099,загальноосвтняшкола3ступ4комунальнавластносттерторальнагромадимжмеринкивницькаобл
Вінницька область,місто,місто Козятин,"Загальноосвітній навчально-виховний комплекс І-ІІІ ступенів ""школа-дитячий садок"" №6 Козятинської міської ради Вінницької області",I-III,,25,19,6,110,155,10,5284.7,5901.1,ні,2203100000,комунальна,7137,26031191,2019,05,25844555,загальноосвтнйнавчальновиховнийкомплекс3ступшколадитячийсадок6козятинськавницькаобл
Вінницька область,місто,місто Козятин,"Комунальний заклад ""Навчально-виховний комплекс І-ІІІ ступенів ""ліцей-школа"" Козятинської міської ради Вінницької області""",I-III,,63,27,9,781,781,30,14055.5,15208.8,ні,2203100000,комунальна,22498,25512362,2019,05,38986337,навчальновиховнийкомплекс3ступлцейшколакозятинськавницькаобл
Вінницька область,місто,місто Ладижин,Ладижинська загальноосвітня школа І-ІІІ ступенів №2 Ладижинської міської ради Вінницької області,I-III,,71,27,13,936,936,33,15407.8,16007.1,ні,2204100000,комунальна,7809,25945998,2019,05,26219552,ладижинськазагальноосвтняшкола3ступ2ладижинськавницькаобл
Вінницька область,село,Барський район,Митківська загальноосвітня школа І-ІІІ ступенів Барського району Вінницької області,I-III,,20,12,1,77,77,7,2928.6,3371.6,ні,2301200000,комунальна,6910,26229556,2019,05,26229556,митквськазагальноосвтняшкола3ступвницькаобл
Вінницька область,село,Барський район,Каришківська загальноосвітня школа І-ІІІ ступенів,I-III,,22,17,5,87,87,11,3980.4,4541.4,ні,2301200000,комунальна,6927,02141288,2019,05,13337801,каришквськазагальноосвтняшкола3ступен
Вінницька область,село,Бершадський район,Тернівська загальноосвітня школа І-ІІІ ступенів,I-III,,14,9,2,79,79,9,3994.436,4430.723,ні,2302200000,комунальна,6142,26228315,2019,05,26228315,тернвськазагальноосвтняшкола3ступен
Вінницька область,село,Вінницький район,Михайлівська середня загальноосвітня школа І-ІІІ ступенів,I-III,,25,20,0,178,178,11,5564.501,6212.86,ні,2303200000,комунальна,8166,26242195,2019,05,26242195,михайлвськасереднязагальноосвтняшкола3ступен
Вінницька область,село,Вінницький район,"Комунальний заклад ""Мізяківсько - Хутірський навчально-виховний коплекс: загальноосвітня школа І-ІІІ ступенів - дошільний навчальний заклад Вінницького району Вінницької області""",I-III,,30,26,6,165,215,10,5314.332,6512.545,ні,2303200000,комунальна,10471,26242150,2019,05,26242150,мзяквськохутрськийнавчальновиховнийкоплексзагальноосвтняшкола3ступдошльнийнавчальнийзакладвницькаобл
Вінницька область,село,Вінницький район,Оленівський НВК: ЗОШ І-ІІІ ст ДНЗ,I-III,,19,26,3,103,123,11,5340.12,6103.768,ні,2303200000,комунальна,10474,26229355,2019,05,26229355,оленвськийнвкзагальноосвтняшкола3стдн
Вінницька область,село,Вінницький район,Писарівська загальноосвітня школа І - ІІІ ступенів,I-III,,21,15,4,222,222,11,5199.2226,6049.729,ні,2303200000,комунальна,10475,26235048,2019,05,25753120,писарвськазагальноосвтняшкола3ступен
Вінницька область,село,Жмеринський район,"Олександрівська ЗОШ І-ІІІ ступенів імені Д. Ф. Касьянчука, Жмеринського району, Вінницької області",I-III,,19,9,7,86,86,11,3445,4463,ні,2305200000,комунальна,7356,26242551,2019,05,26242551,олександрвськазагальноосвтняшкола3ступмендфкасьянчукавницькаобл
Вінницька область,село,Іллінецький район,"Городоцька загальноосвітня школа І-ІІІ ступеныв Іллінецького району,Вінницької області",I-III,,19,13,2,130,130,11,3884,4347.2,ні,2306200000,комунальна,7197,26235108,2019,05,26235108,городоцьказагальноосвтняшкола3ступенивллнецькогоувницькаобл
Вінницька область,село,Іллінецький район,Леухівська загальноосвітня школи І - ІІІ ступенів Іллінецької районної ради Вінницької області,I-III,,19,11,3,108,108,11,4191.1,4429.5,ні,2306200000,комунальна,7208,26241959,2019,05,26241959,леухвськазагальноосвтняшколи3ступллнецькавницькаобл
Вінницька область,село,Калинівський район,"Комунальний заклад ""Навчально-виховний комплекс загальноосвітня школа І-ІІІ ступенів - дошкільний навчальний заклад село Писарівка Калинівського району Вінницької області""_x000D_
",I-III,,25,11,5,86,96,11,3901.6,4202.3,ні,2307200000,комунальна,6251,26286599,2019,05,26286599,навчальновиховнийкомплексзагальноосвтняшкола3ступдошкльнийнавчальнийзакладсписарвкавницькаоблх000
Вінницька область,село,Калинівський район,Корделівська середня загальноосвітня школа І-ІІІ ступенів с.Корделівки Калинівського району Вінницької області,I-III,,37,19,3,350,350,18,7783.3,8295.5,ні,2307200000,комунальна,7715,26142074,2019,05,26142074,корделвськасереднязагальноосвтняшкола3ступскорделвкивницькаобл
Вінницька область,село,Козятинський район,"Вівсяницький навчально-виховний комплекс І -ІІІ ступенів ""Школа-дитячий садок""",I-III,,21,20,1,108,126,11,4245,4428,ні,2308200000,комунальна,7505,35469702,2019,05,35469702,ввсяницькийнавчальновиховнийкомплекс3ступшколадитячийсадо
Вінницька область,село,Козятинський район,"Юрівський ЗНВК І-ІІІ ступенів ""Школа-дитячий садок""",I-III,,17,13,0,54,71,8,2365,2312.2,ні,2308200000,комунальна,7533,34377616,2019,05,34377616,юрвськийзнавчальновиховнийкомплекс3ступшколадитячийсадо
Вінницька область,село,Крижопільський район,"Навчально- виховний комплекс ""Загальноосвітній навчальний заклад І-ІІІ ступенів - дошкільний навчальний заклад"" села Шарапанівка Крижопільського району Вінницької області",I-III,,17,13,2,61,68,8,3744.6,4221.4,ні,2309200000,комунальна,11377,02141360,2019,05,26223654,навчальновиховнийкомплексзагальноосвтнйнавчальнийзаклад3ступдошкльнийнавчальнийзакладсшарапанвкавницькаобл
Вінницька область,село,Липовецький район,Зозівська загальноосвітня школа І-ІІІ ст. Липовецької районної ради Вінницької області,I-III,,22,18,5,174,174,10,4798.8,5075.6,ні,2310200000,комунальна,11395,02141377,2019,05,26243817,зозвськазагальноосвтняшкола3ступлиповецькавницькаобл
Вінницька область,місто,Липовецький район,Липовецька загальноосвітня школа І - ІІІ ст.№1 імені Василя Липківського Липовецької районної ради Вінницької області,I-III,,44,28,5,363,363,19,8757.4,13128.3,ні,2310200000,комунальна,11398,41865886,2019,05,41865886,липовецьказагальноосвтняшкола3ступ1менвасилялипквськоголиповецькавницькаобл
Вінницька область,село,Літинський район,Середня загальноосвітня школа І-ІІІ ст. с. Пеньківка Літинської районної ради Вінницької області,I-III,,21,14,2,186,186,11,4752.25,4880.527,ні,2311200000,комунальна,7993,26228539,2019,05,26228539,середнязагальноосвтняшкола3ступспеньквкалтинськавницькаобл
Вінницька область,село,Мурованокуриловецький район,Середня загальноосвітня школа І-ІІІ ступенів с.Вищеольчедаїв Мурованокурилдовецького району Вінницької області,I-III,,23,15,4,184,184,11,5019.8,5044.2,ні,2313200000,комунальна,6585,02141408,2019,05,25504061,середнязагальноосвтняшкола3ступсвищеольчедаввницькаобл
Вінницька область,місто,Піщанський район,"Піщанський навчально-виховний комплекс ""Загальноосвітня школа І-ІІІ ст. - ліцей"" смт. Піщанка, Піщанського району, Вінницької області",I-III,,32,16,5,277,277,15,7016.5,6640.3,ні,2316200000,комунальна,11422,38460152,2019,05,38460152,пщанськийнавчальновиховнийкомплексзагальноосвтняшкола3ступлцейсмтпщанкавницькаобл
Вінницька область,село,Тиврівський район,Краснянська середня загальноосвітня школа І-ІІІ ступенів,I-III,,21,17,3,227,227,11,4983,5471.1,ні,2319200000,комунальна,8017,26233991,2019,05,26233991,краснянськасереднязагальноосвтняшкола3ступен
Вінницька область,село,Томашпільський район,Комаргородська загальноосвітня школа І-ІІІ ступенів Томашпільського району Вінницької області,I-III,,23,14,5,167,167,11,5246.7,5253,ні,2320200000,комунальна,6949,26223097,2019,05,26223097,комаргородськазагальноосвтняшкола3ступвницькаобл
Вінницька область,село,Тростянецький район,Савинецька середня загальноосвітня школа І - ІІІ ступенів с.Савинці Тростянецького району Вінницької області,I-III,,20,16,4,104,104,10,4467.745,4726.661,ні,2321200000,комунальна,7132,26227770,2019,05,26227770,савинецькасереднязагальноосвтняшкола3ступссавинцвницькаобл
Вінницька область,село,Тульчинський район,"Печерська загальноосвітня школа І-ІІІ ступенів _x000D_
Тульчинської районної ради Вінницької області",I-III,,21,10,3,113,113,11,4032.7,4398.6,ні,2322200000,комунальна,6458,21723228,2019,05,21723228,печерськазагальноосвтняшкола3ступх000dтульчинськавницькаобл
Вінницька область,село,Хмільницький район,"Комунальний заклад ""Опорний заклад загальної середньої освіти І-ІІІ ступенів с.Сальниця""",I-III,,21,26,2,182,242,11,5659.5,5998.200000000001,ні,2323200000,комунальна,8294,26223737,2019,05,43306032,опорний3ступссальниц
Вінницька область,село,Хмільницький район,"НАВЧАЛЬНО-ВИХОВНИЙ КОМПЛЕКС_x000D_
«ЗАГАЛЬНООСВІТНЯ ШКОЛА І-ІІІ СТУПЕНІВ - ДОШКІЛЬНИЙ НАВЧАЛЬНИЙ ЗАКЛАД» С. ТОМАШПІЛЬ_x000D_
 ",I-III,,11,12,0,50,74,7,2716,2898,ні,2323200000,комунальна,8296,26223973,2019,05,26223973,навчальновиховнийкомплексх000dзагальноосвтняшкола3ступдошкльнийнавчальнийзакладстомашпльх000
Вінницька область,село,Хмільницький район,"Загальноосвітня школа І-ІІІ ступенів с. Лозна Хмільницької районної державної адміністрації , Вінницької області",I-III,,15,10,0,56,56,7,2730.4,2906.4,ні,2323200000,комунальна,22562,26223915,2019,05,26223915,загальноосвтняшкола3ступслознахмльницькадержавнаадмнстрацвницькаобл
Вінницька область,село,Хмільницький район,Загальноосвітня школа І-ІІІ ступенів село Великий Митник Хмільницький район Вінницька область,I-III,,21,11,3,166,166,11,3762.6,4140.3,ні,2323200000,комунальна,22654,25918704,2019,05,25918704,загальноосвтняшкола3ступсвеликиймитниквницькаобл
Вінницька область,село,Чечельницький район,Комунальний заклад «Стратіївський навчально-виховний комплекс І–ІІІ ступенів «загальноосвітній навчальний заклад — дошкільний навчальний заклад» Чечельницької районної ради Вінницької області,I-III,,20,18,0,83,111,11,3990.8,4339.9,ні,2325200000,комунальна,7327,26285678,2019,05,26285678,стратвськийнавчальновиховнийкомплекс3ступзагальноосвтнйнавчальнийзаклад—дошкльнийнавчальнийзакладчечельницькавницькаобл
Вінницька область,село,Шаргородський район,Руданська загальноосвітня школа І-ІІІ ступенів,I-III,,21,16,5,104,104,11,3943.004,4345.353,ні,2326200000,комунальна,8416,26228999,2019,05,26228999,руданськазагальноосвтняшкола3ступен
Вінницька область,місто,Калинівська міська ОТГ,"Комунальний заклад ""Калинівська зальноосвітня школа І-ІІІ ступенів №2-гімназія"" Вінницька область",I-III,,81,34,18,936,936,39,18676.954,20181.051,ні,2501000000,комунальна,5404,40385478,2019,05,21726646,калинвськазальноосвтняшкола3ступ2гмназявницькаобл
Вінницька область,село,Жданівська сільська ОТГ,"Комунальний заклад ""Загальноосвітня школа І-ІІІ ст. с. Жданівка Жданівської сільської ради, Хмільницького р-ну, Вінницької області""",I-III,,23,15,5,219,219,11,6898.8,6456.4,ні,2515000000,комунальна,8283,26224100,2019,05,26224100,загальноосвтняшкола3ступсжданвкажданвськахмльницькогорнувницькаобл
Вінницька область,село,Мурафська сільська ОТГ,Мурафська середня загальноосвітня школа І-ІІІ ступенів Мурафської сільської      ради Шаргородського району Вінницкої області,I-III,,36,24,2,340,340,19,10102.14469,11442.76,ні,2522000000,комунальна,6315,26229036,2019,05,26229036,мурафськасереднязагальноосвтняшкола3ступмурафськавницкаобл
Вінницька область,місто,Гніванська міська ОТГ,"Гніванська альтернативна середня загальноосвітня школа І-ІІІ ступенів №1 ім.А.С.Макаренка розвитку здібностей дитини м.Гнівань, Тиврівський район Вінницької області",I-III,,51,19,7,556,556,23,11476.5,12623.9,ні,2533000000,комунальна,8034,26242083,2019,05,26242083,гнванськаальтернативнасереднязагальноосвтняшкола3ступ1менасмакаренкарозвиткуздбностейдитинимгнваньвницькаобл
Вінницька область,місто,Вінницька міська ОТГ,"Комунальний заклад ""Загальноосвітня школа І-ІІІ ступенів №19 Вінницької міської ради""",I-III,,36,13,4,534,534,17,7445.639,8753.078,ні,2536000000,комунальна,8837,26235447,2019,05,26235447,загальноосвтняшкола3ступ19вницькао
Вінницька область,місто,Літинська селищна ОТГ,Літинська середня загальноосвітня школаІ-ІІІступенів №1,I-III,,51,23,8,629,629,26,11954.56,13095.153,ні,2541000000,комунальна,8003,02141383,2019,05,25500353,лтинськасереднязагальноосвтняшкола3ступ1
Волинська область,місто,місто Ковель,"Комунальний заклад ""навчально-виховний комплекс ""загальноосвітня школа І-ІІІ ступеня № 13 - колегіум"" міста Ковеля"" Ковельської міської ради Волинської області",I-III,,93,35,14,1319,1319,47,20534.3,23067.2,ні,3203100000,комунальна,17260,20146183,2019,07,20146183,навчальновиховнийкомплексзагальноосвтняшкола3ступ13колегуммковеляковельськаволинськаобл
Волинська область,село,Горохівський район,Загальноосвітня школа І-ІІІ ст с. Вільхівка Горохівського району Волинської області,I-III,,22,14,0,143,143,11,4267.2,4610.8,ні,3302200000,комунальна,17038,23019999,2019,07,23019999,загальноосвтняшкола3стсвльхвкаволинськаобл
Волинська область,село,Горохівський район,Загальноосвітня школа І-ІІІ ступеня села Колодеже Горохівського району Волинської області,I-III,,17,10,2,66,66,9,3273.8,3533.9,ні,3302200000,комунальна,17041,02141710,2019,07,23019964,загальноосвтняшкола3ступсколодежеволинськаобл
Волинська область,село,Горохівський район,Загальноосвітня школа І-ІІІ ступеня с. Шклинь Горохівського райну Волинської області,I-III,,17,8,1,118,118,10,3785.4,4200,ні,3302200000,комунальна,17051,23019864,2019,07,23019864,загальноосвтняшкола3ступсшклиньгорохвськогорайнуволинськаобл
Волинська область,село,Камінь-Каширський район,Загальноосвітня школа І - ІІІ ступенів села Карасин Камінь-Каширської районної ради Волинської області,I-III,,30,14,11,198,198,11,5180.3,5571.1,ні,3304200000,комунальна,17149,25086540,2019,07,25086540,загальноосвтняшкола3ступскарасинкамнькаширськаволинськаобл
Волинська область,село,Камінь-Каширський район,Загальноосвітня школа І-ІІІ ступенів с.Нові Червища Камінь-Каширської районної ради Волинської області,I-III,,34,13,6,183,183,11,4707.5,5131.4,ні,3304200000,комунальна,17151,25086563,2019,07,25086563,загальноосвтняшкола3ступсновчервищакамнькаширськаволинськаобл
Волинська область,село,Камінь-Каширський район,Загальноосвітня школа І-ІІІ ступенів с. Піщане Камінь-Каширської районної ради Волинської області,I-III,,28,9,7,229,229,12,4597.2,4827.7,ні,3304200000,комунальна,17154,25086586,2019,07,25086586,загальноосвтняшкола3ступспщанекамнькаширськаволинськаобл
Волинська область,село,Камінь-Каширський район,Загальноосвітня школа І-ІІІ ступенів села Полиці Камінь-Каширської районної ради Волинської області,I-III,,28,11,4,131,131,11,4653.7,4960,ні,3304200000,комунальна,17156,25086600,2019,07,25086600,загальноосвтняшкола3ступсполицкамнькаширськаволинськаобл
Волинська область,село,Камінь-Каширський район,Загальноосвітня школа І-ІІІ ступеня с. Раків Ліс Камінь-Каширської районної ради Волинської області,I-III,,61,24,13,598,598,26,12238,13593.2,ні,3304200000,комунальна,17157,25086617,2019,07,25086617,загальноосвтняшкола3ступсраквлскамнькаширськаволинськаобл
Волинська область,село,Камінь-Каширський район,Загальноосвітня школа І-ІІІ ступенів села Сошичне Камінь-Каширської районної ради Волинської області,I-III,,42,15,9,327,327,17,7321,7639.6,ні,3304200000,комунальна,17158,25086623,2019,07,25086623,загальноосвтняшкола3ступссошичнекамнькаширськаволинськаобл
