regname,eotype,areaname,eoname,DISO,EDRPOU,year,KOATUU_2020_reg,EDRPOU_checked,id
Вінницька область,місто,Жмеринська міська ОТГ,"Загальноосвітня школа І-ІІІ ступенів №1 комунальної власності територіальної громади міста Жмеринки Вінницької області_x000D_
",8173,26244113,2019,05,26244113,загальноосвтняшкола3ступ1комунальнавласностмжмеринкивницькаоблх000
Вінницька область,місто,Жмеринська міська ОТГ,Загальноосвітня школа I-III ступенів №4 комунальної властності теріторіальної громади міста Жмеринки Вінницької області,8176,26244099,2019,05,26244099,загальноосвтняшкола3ступ4комунальнавластносттерторальнагромадимжмеринкивницькаобл
Вінницька область,місто,місто Козятин,"Загальноосвітній навчально-виховний комплекс І-ІІІ ступенів ""школа-дитячий садок"" №6 Козятинської міської ради Вінницької області",7137,26031191,2019,05,25844555,загальноосвтнйнавчальновиховнийкомплекс3ступшколадитячийсадок6козятинськавницькаобл
Вінницька область,місто,місто Козятин,"Комунальний заклад ""Навчально-виховний комплекс І-ІІІ ступенів ""ліцей-школа"" Козятинської міської ради Вінницької області""",22498,25512362,2019,05,38986337,навчальновиховнийкомплекс3ступлцейшколакозятинськавницькаобл
Вінницька область,місто,місто Ладижин,Ладижинська загальноосвітня школа І-ІІІ ступенів №2 Ладижинської міської ради Вінницької області,7809,25945998,2019,05,26219552,ладижинськазагальноосвтняшкола3ступ2ладижинськавницькаобл
Вінницька область,село,Барський район,Митківська загальноосвітня школа І-ІІІ ступенів Барського району Вінницької області,6910,26229556,2019,05,26229556,митквськазагальноосвтняшкола3ступвницькаобл
Вінницька область,село,Барський район,Каришківська загальноосвітня школа І-ІІІ ступенів,6927,02141288,2019,05,13337801,каришквськазагальноосвтняшкола3ступен
Вінницька область,село,Бершадський район,Тернівська загальноосвітня школа І-ІІІ ступенів,6142,26228315,2019,05,26228315,тернвськазагальноосвтняшкола3ступен
Вінницька область,село,Вінницький район,Михайлівська середня загальноосвітня школа І-ІІІ ступенів,8166,26242195,2019,05,13339409,михайлвськасереднязагальноосвтняшкола3ступен
Вінницька область,село,Вінницький район,"Комунальний заклад ""Мізяківсько - Хутірський навчально-виховний коплекс: загальноосвітня школа І-ІІІ ступенів - дошільний навчальний заклад Вінницького району Вінницької області""",10471,26242150,2019,05,26242150,мзяквськохутрськийнавчальновиховнийкоплексзагальноосвтняшкола3ступдошльнийнавчальнийзакладвницькаобл
Вінницька область,село,Вінницький район,Оленівський НВК: ЗОШ І-ІІІ ст ДНЗ,10474,26229355,2019,05,26229355,оленвськийнвкзагальноосвтняшкола3стдн
Вінницька область,село,Вінницький район,Писарівська загальноосвітня школа І - ІІІ ступенів,10475,26235048,2019,05,25753120,писарвськазагальноосвтняшкола3ступен
Вінницька область,село,Жмеринський район,"Олександрівська ЗОШ І-ІІІ ступенів імені Д. Ф. Касьянчука, Жмеринського району, Вінницької області",7356,26242551,2019,05,26242551,олександрвськазагальноосвтняшкола3ступмендфкасьянчукавницькаобл
Вінницька область,село,Іллінецький район,"Городоцька загальноосвітня школа І-ІІІ ступеныв Іллінецького району,Вінницької області",7197,26235108,2019,05,26235108,городоцьказагальноосвтняшкола3ступенивллнецькогоувницькаобл
Вінницька область,село,Іллінецький район,Леухівська загальноосвітня школи І - ІІІ ступенів Іллінецької районної ради Вінницької області,7208,26241959,2019,05,26241959,леухвськазагальноосвтняшколи3ступллнецькавницькаобл
Вінницька область,село,Калинівський район,"Комунальний заклад ""Навчально-виховний комплекс загальноосвітня школа І-ІІІ ступенів - дошкільний навчальний заклад село Писарівка Калинівського району Вінницької області""_x000D_
",6251,26286599,2019,05,26286599,навчальновиховнийкомплексзагальноосвтняшкола3ступдошкльнийнавчальнийзакладсписарвкавницькаоблх000
Вінницька область,село,Калинівський район,Корделівська середня загальноосвітня школа І-ІІІ ступенів с.Корделівки Калинівського району Вінницької області,7715,26142074,2019,05,26142074,корделвськасереднязагальноосвтняшкола3ступскорделвкивницькаобл
Вінницька область,село,Козятинський район,"Вівсяницький навчально-виховний комплекс І -ІІІ ступенів ""Школа-дитячий садок""",7505,35469702,2019,05,35469702,ввсяницькийнавчальновиховнийкомплекс3ступшколадитячийсадо
Вінницька область,село,Козятинський район,"Юрівський ЗНВК І-ІІІ ступенів ""Школа-дитячий садок""",7533,34377616,2019,05,34377616,юрвськийзнавчальновиховнийкомплекс3ступшколадитячийсадо
Вінницька область,село,Крижопільський район,"Навчально- виховний комплекс ""Загальноосвітній навчальний заклад І-ІІІ ступенів - дошкільний навчальний заклад"" села Шарапанівка Крижопільського району Вінницької області",11377,02141360,2019,05,26223654,навчальновиховнийкомплексзагальноосвтнйнавчальнийзаклад3ступдошкльнийнавчальнийзакладсшарапанвкавницькаобл
Вінницька область,село,Липовецький район,Зозівська загальноосвітня школа І-ІІІ ст. Липовецької районної ради Вінницької області,11395,02141377,2019,05,26243817,зозвськазагальноосвтняшкола3ступлиповецькавницькаобл
Вінницька область,місто,Липовецький район,Липовецька загальноосвітня школа І - ІІІ ст.№1 імені Василя Липківського Липовецької районної ради Вінницької області,11398,41865886,2019,05,41865886,липовецьказагальноосвтняшкола3ступ1менвасилялипквськоголиповецькавницькаобл
Вінницька область,село,Літинський район,Середня загальноосвітня школа І-ІІІ ст. с. Пеньківка Літинської районної ради Вінницької області,7993,26228539,2019,05,26228539,середнязагальноосвтняшкола3ступспеньквкалтинськавницькаобл
Вінницька область,село,Мурованокуриловецький район,Середня загальноосвітня школа І-ІІІ ступенів с.Вищеольчедаїв Мурованокурилдовецького району Вінницької області,6585,02141408,2019,05,25504061,середнязагальноосвтняшкола3ступсвищеольчедаввницькаобл
Вінницька область,місто,Піщанський район,"Піщанський навчально-виховний комплекс ""Загальноосвітня школа І-ІІІ ст. - ліцей"" смт. Піщанка, Піщанського району, Вінницької області",11422,38460152,2019,05,38460152,пщанськийнавчальновиховнийкомплексзагальноосвтняшкола3ступлцейсмтпщанкавницькаобл
Вінницька область,село,Тиврівський район,Краснянська середня загальноосвітня школа І-ІІІ ступенів,8017,26233991,2019,05,26233991,краснянськасереднязагальноосвтняшкола3ступен
Вінницька область,село,Томашпільський район,Комаргородська загальноосвітня школа І-ІІІ ступенів Томашпільського району Вінницької області,6949,26223097,2019,05,26223097,комаргородськазагальноосвтняшкола3ступвницькаобл
Вінницька область,село,Тростянецький район,Савинецька середня загальноосвітня школа І - ІІІ ступенів с.Савинці Тростянецького району Вінницької області,7132,26227770,2019,05,26227770,савинецькасереднязагальноосвтняшкола3ступссавинцвницькаобл
Вінницька область,село,Тульчинський район,"Печерська загальноосвітня школа І-ІІІ ступенів _x000D_
Тульчинської районної ради Вінницької області",6458,21723228,2019,05,21723228,печерськазагальноосвтняшкола3ступх000dтульчинськавницькаобл
Вінницька область,село,Хмільницький район,"Комунальний заклад ""Опорний заклад загальної середньої освіти І-ІІІ ступенів с.Сальниця""",8294,26223737,2019,05,43306032,опорний3ступссальниц
Вінницька область,село,Хмільницький район,"НАВЧАЛЬНО-ВИХОВНИЙ КОМПЛЕКС_x000D_
«ЗАГАЛЬНООСВІТНЯ ШКОЛА І-ІІІ СТУПЕНІВ - ДОШКІЛЬНИЙ НАВЧАЛЬНИЙ ЗАКЛАД» С. ТОМАШПІЛЬ_x000D_
 ",8296,26223973,2019,05,26223973,навчальновиховнийкомплексх000dзагальноосвтняшкола3ступдошкльнийнавчальнийзакладстомашпльх000
Вінницька область,село,Хмільницький район,"Загальноосвітня школа І-ІІІ ступенів с. Лозна Хмільницької районної державної адміністрації , Вінницької області",22562,26223915,2019,05,26223915,загальноосвтняшкола3ступслознахмльницькадержавнаадмнстрацвницькаобл
Вінницька область,село,Хмільницький район,Загальноосвітня школа І-ІІІ ступенів село Великий Митник Хмільницький район Вінницька область,22654,25918704,2019,05,25918704,загальноосвтняшкола3ступсвеликиймитниквницькаобл
Вінницька область,село,Чечельницький район,Комунальний заклад «Стратіївський навчально-виховний комплекс І–ІІІ ступенів «загальноосвітній навчальний заклад — дошкільний навчальний заклад» Чечельницької районної ради Вінницької області,7327,26285678,2019,05,26285678,стратвськийнавчальновиховнийкомплекс3ступзагальноосвтнйнавчальнийзаклад—дошкльнийнавчальнийзакладчечельницькавницькаобл
Вінницька область,село,Шаргородський район,Руданська загальноосвітня школа І-ІІІ ступенів,8416,26228999,2019,05,26228999,руданськазагальноосвтняшкола3ступен
Вінницька область,місто,Калинівська міська ОТГ,"Комунальний заклад ""Калинівська зальноосвітня школа І-ІІІ ступенів №2-гімназія"" Вінницька область",5404,40385478,2019,05,21726646,калинвськазальноосвтняшкола3ступ2гмназявницькаобл
Вінницька область,село,Жданівська сільська ОТГ,"Комунальний заклад ""Загальноосвітня школа І-ІІІ ст. с. Жданівка Жданівської сільської ради, Хмільницького р-ну, Вінницької області""",8283,26224100,2019,05,26224100,загальноосвтняшкола3ступсжданвкажданвськахмльницькогорнувницькаобл
Вінницька область,село,Мурафська сільська ОТГ,Мурафська середня загальноосвітня школа І-ІІІ ступенів Мурафської сільської      ради Шаргородського району Вінницкої області,6315,26229036,2019,05,26229036,мурафськасереднязагальноосвтняшкола3ступмурафськавницкаобл
Вінницька область,місто,Гніванська міська ОТГ,"Гніванська альтернативна середня загальноосвітня школа І-ІІІ ступенів №1 ім.А.С.Макаренка розвитку здібностей дитини м.Гнівань, Тиврівський район Вінницької області",8034,26242083,2019,05,26242083,гнванськаальтернативнасереднязагальноосвтняшкола3ступ1менасмакаренкарозвиткуздбностейдитинимгнваньвницькаобл
Вінницька область,місто,Вінницька міська ОТГ,"Комунальний заклад ""Загальноосвітня школа І-ІІІ ступенів №19 Вінницької міської ради""",8837,26235447,2019,05,26235447,загальноосвтняшкола3ступ19вницькао
Вінницька область,місто,Літинська селищна ОТГ,Літинська середня загальноосвітня школаІ-ІІІступенів №1,8003,02141383,2019,05,25500353,лтинськасереднязагальноосвтняшкола3ступ1
Волинська область,місто,місто Ковель,"Комунальний заклад ""навчально-виховний комплекс ""загальноосвітня школа І-ІІІ ступеня № 13 - колегіум"" міста Ковеля"" Ковельської міської ради Волинської області",17260,20146183,2019,07,20146183,навчальновиховнийкомплексзагальноосвтняшкола3ступ13колегуммковеляковельськаволинськаобл
Волинська область,село,Горохівський район,Загальноосвітня школа І-ІІІ ст с. Вільхівка Горохівського району Волинської області,17038,23019999,2019,07,23019999,загальноосвтняшкола3стсвльхвкаволинськаобл
Волинська область,село,Горохівський район,Загальноосвітня школа І-ІІІ ступеня села Колодеже Горохівського району Волинської області,17041,02141710,2019,07,23019964,загальноосвтняшкола3ступсколодежеволинськаобл
Волинська область,село,Горохівський район,Загальноосвітня школа І-ІІІ ступеня с. Шклинь Горохівського райну Волинської області,17051,23019864,2019,07,23019864,загальноосвтняшкола3ступсшклиньгорохвськогорайнуволинськаобл
Волинська область,село,Камінь-Каширський район,Загальноосвітня школа І - ІІІ ступенів села Карасин Камінь-Каширської районної ради Волинської області,17149,25086540,2019,07,25086540,загальноосвтняшкола3ступскарасинкамнькаширськаволинськаобл
Волинська область,село,Камінь-Каширський район,Загальноосвітня школа І-ІІІ ступенів с.Нові Червища Камінь-Каширської районної ради Волинської області,17151,25086563,2019,07,25086563,загальноосвтняшкола3ступсновчервищакамнькаширськаволинськаобл
Волинська область,село,Камінь-Каширський район,Загальноосвітня школа І-ІІІ ступенів с. Піщане Камінь-Каширської районної ради Волинської області,17154,25086586,2019,07,25086586,загальноосвтняшкола3ступспщанекамнькаширськаволинськаобл
Волинська область,село,Камінь-Каширський район,Загальноосвітня школа І-ІІІ ступенів села Полиці Камінь-Каширської районної ради Волинської області,17156,25086600,2019,07,25086600,загальноосвтняшкола3ступсполицкамнькаширськаволинськаобл
Волинська область,село,Камінь-Каширський район,Загальноосвітня школа І-ІІІ ступеня с. Раків Ліс Камінь-Каширської районної ради Волинської області,17157,25086617,2019,07,25086617,загальноосвтняшкола3ступсраквлскамнькаширськаволинськаобл
Волинська область,село,Камінь-Каширський район,Загальноосвітня школа І-ІІІ ступенів села Сошичне Камінь-Каширської районної ради Волинської області,17158,25086623,2019,07,25086623,загальноосвтняшкола3ступссошичнекамнькаширськаволинськаобл
Волинська область,село,Камінь-Каширський район,Загальноосвітня школа І-ІІІ ступенів села Тоболи Камінь-Каширської районної ради Волинської області,17159,25086634,2019,07,25086634,загальноосвтняшкола3ступстоболикамнькаширськаволинськаобл
Волинська область,місто,Ратнівський район,"НВК ""ЗОШ І-ІІІ ступеня №1 - гімназія ім. В.Газіна"" смт Ратне",17588,21747967,2019,07,21747967,навчальновиховнийкомплексзагальноосвтняшкола3ступ1гмназяменвгазнасмтратн
Волинська область,село,Рожищенський район,Загальноосвітня школа I-III ступеня с. Доросині Рожищенського району Волинської області,17613,20140460,2019,07,20140460,загальноосвтняшкола3ступсдоросинволинськаобл
Волинська область,місто,Рожищенський район,Загальноосвітня школа І-ІІІ ступеня смт. Дубище Рожищенської районної ради Волинської області,17614,20140476,2019,07,20140476,загальноосвтняшкола3ступсмтдубищерожищенськаволинськаобл
Волинська область,село,Рожищенський район,Загальноосвітня школа І-ІІІ ступеня с. Літогоща Рожищенського р-ну Волинської обл.,17618,20140602,2019,07,20140602,загальноосвтняшкола3ступслтогощарожищенськогорнуволинськаоб
Волинська область,село,Рожищенський район,Загальноосвітня школа І-ІІІ ст. с. Топільне Рожищенського району Волинської області,17627,20140819,2019,07,20140819,загальноосвтняшкола3ступстопльневолинськаобл
Волинська область,село,Велицька сільська ОТГ,загальноосвітня школа І-ІІІ ступеня с.Підріжжя,17276,41420722,2019,07,20141518,загальноосвтняшкола3ступспдржж
Волинська область,село,Павлівська сільська ОТГ,Грушівська початкова школа Павлівської сільської ради Іваничівського району Волинської області,17122,23016707,2019,07,23016707,грушвськапочатковашколапавлвськаволинськаобл
Волинська область,село,Любомльська міська ОТГ,Городненський заклад загальної середньої освіти І-ІІ ступенів Лобомльської міської ради,17479,23018362,2019,07,23018362,городненський2ступлобомльськао
Волинська область,село,Оваднівська сільська ОТГ,Загальноосвітня школа І-ІІІ ступенів с. Овадне,16998,23018971,2019,07,23018971,загальноосвтняшкола3ступсовадн
Волинська область,село,Гуто-Боровенська сільська ОТГ,Загальноосвітня школа I-III ступенів села Житнівка Гуто- Боровненської сільської ради ОТГ Камінь - Каширського району Волинської області,17178,40211755,2019,07,40211755,загальноосвтняшкола3ступсжитнвкагутоборовненськаотгкамньволинськаобл
