Житомирська область,місто,Черняхівський район,Черняхівська загальноосвітня школа І - ІІІ ступенів,I-III,,46,22,5,632,632,25,11061.6,15662.5,ні,6322200000,комунальна,16061,06671267,2019,18,06671267,черняхвськазагальноосвтняшкола3ступен
Житомирська область,село,Черняхівський район,Селецька загальноосвітня школа І-ІІ ступенів Житомирської області Черняхівського району,I-III,,10,3,0,29,29,2,1357.6,870.2,ні,6322200000,комунальна,16069,06671349,2019,18,06670486,селецьказагальноосвтняшкола2ступжитомирськаобл
Житомирська область,село,Високівська сільська ОТГ,Забрідська ЗОШ І-ІІІ ступенів Високівської сільської ради,I-III,,23,16,8,117,117,11,4409.4,4530.8,ні,6501000000,комунальна,16059,06671474,2019,18,06671474,забрдськазагальноосвтняшкола3ступвисоквськао
Житомирська область,село,Дубрівська сільська ОТГ,Дубрівська загальноосвітня школа I-III ступенів №1 Баранівського району Житомирської області,I-III,,32,30,2,297,297,12,6739.9,8236.2,ні,6503000000,комунальна,15586,20407873,2019,18,20407873,дубрвськазагальноосвтняшкола3ступ1житомирськаобл
Житомирська область,село,Дубрівська сільська ОТГ,Мокренська ЗАГАЛЬНООСВІТНЯ ШКОЛА І-ІІІ ступенів,I-III,,20,16,4,82,82,10,3837.2,4826.9,ні,6503000000,комунальна,15599,20408039,2019,18,20408039,мокренськазагальноосвтняшкола3ступен
Житомирська область,село,Народицька селищна ОТГ,"Базарський навчально-виховний комплекс ""Загальноосвітній навчальний заклад І-ІІІ ступенів - дошкільний навчальний заклад""",I-III,,25,16,9,113,141,11,4831.7,4959.2,ні,6505000000,комунальна,15883,06670374,2019,18,06670374,базарськийнавчальновиховнийкомплексзагальноосвтнйнавчальнийзаклад3ступдошкльнийнавчальнийзакла
Житомирська область,місто,Новоборівська селищна ОТГ,"12114 смт. Нова Борова, Житомирська область, Хорошівський район, вулиця Шкільна,5  Новоборівський ліцей імені Василя Лунька Відділ освіти, охорони здоровя і соціально-культурної сфери Новоборівської селищної ради",I-III,,36,24,10,390,390,19,7826.1,9487.4,опорна,6506000000,комунальна,15655,06669263,2019,18,06669263,12114смтновабороважитомирськаоблвулицяшкльна5новоборвськийлцейменвасилялунькавддлосвтиохорониздоровясоцальнокультурнасфериновоборвськао
Житомирська область,село,Червоненська селищна ОТГ,Глинівецька ЗОШІ-ІІІ ст,I-III,,19,15,2,95,95,11,4071.2,4843,ні,6509000000,комунальна,15562,20408447,2019,18,20408447,глинвецьказош3с
Житомирська область,село,Олевська міська ОТГ,Варварівська загальноосвітня школа І - ІІІ ступенів Олевського району Житомирської області,I-III,,26,11,6,184,184,11,4665.5,5227,ні,6513000000,комунальна,16872,22054835,2019,18,22054835,варварвськазагальноосвтняшкола3ступжитомирськаобл
Житомирська область,село,Олевська міська ОТГ,Майданська загальноосвітня школа І-ІІІ ст.,I-III,,21,10,2,130,130,11,3458.3,3639,ні,6513000000,комунальна,16881,22054960,2019,18,22054960,майданськазагальноосвтняшкола3сту
Житомирська область,місто,Брусилівська селищна ОТГ,Брусиліський ліцей №1 імені І. І. Огієнка Брусилівської селищної ради,I-III,,43,14,8,417,417,20,8774.5,9473.6,опорна,6514000000,комунальна,15624,22067341,2019,18,22067341,брусилськийлцей1меногнкабрусилвськао
Житомирська область,село,Брусилівська селищна ОТГ,Биківська загальноосвітня школа І-ІІІ ступенів Брусилівської селищної ради,I-III,,17,13,3,51,51,9,3122.9,4389.7,ні,6514000000,комунальна,15626,13577882,2019,18,22062295,биквськазагальноосвтняшкола3ступбрусилвськао
Житомирська область,село,Брусилівська селищна ОТГ,Морозівська загальноосвітня школа Брусилівської селищної ради,I-III,,23,15,5,112,112,11,4601.5,5201.1,ні,6514000000,комунальна,15629,24706294,2019,18,24706294,морозвськазагальноосвтняшколабрусилвськао
Житомирська область,місто,Довбиська селищна ОТГ,Мар’янівська загальноосвітня школа І - ІІІ ступенів Баранівської райдержадміністрації Житомирської області,I-III,,28,4,8,212,212,11,5042.3,6064.6,ні,6516000000,комунальна,15581,02142997,2019,18,20407910,марянвськазагальноосвтняшкола3ступбаранвськарайдержадмнстрацжитомирськаобл
Житомирська область,місто,Лугинська селищна ОТГ,Миролюбівський залад загальної середньої освіти І - ІІІ ступенів Лугинсьої селищної ради Лугинського району Житомирської області,I-III,,19,11,2,66,66,7,3281.8,3294.6,ні,6517000000,комунальна,15822,22067298,2019,18,22067298,миролюбвськийзаладзагальнасередньаосвти3ступлугинсьажитомирськаобл
Житомирська область,місто,Лугинська селищна ОТГ,"Гімназія імені В.П. Фількова Лугинської селищної ради _x000D_
Лугинського району Житомирської області",I-III,,54,22,6,399,399,22,10439.2,10618,опорна,6517000000,комунальна,15826,22067217,2019,18,22067217,гмназяменвпфльковалугинськах000dжитомирськаобл
Житомирська область,село,Лугинська селищна ОТГ,"Путиловецький навчально-виховний комплекс ""ДНЗ - ЗНЗ І-ІІІ ступенів"" Лугинської селищної ради Лугинського району Житомирської області",I-III,,26,16,4,75,92,10,3900.4,3877.4,ні,6517000000,комунальна,15829,22067275,2019,18,22067275,путиловецькийнавчальновиховнийкомплексднззагальноосвтнйнавчальнийзаклад3ступлугинськажитомирськаобл
Житомирська область,село,Попільнянська селищна ОТГ,Попільняська загальноосвітня школа І-ІІІ ступенів №2 Попільнянської селищної ради Житомирської області,I-III,,23,17,5,222,222,13,5093.5,6141,ні,6519000000,комунальна,15956,22057325,2019,18,22057325,попльняськазагальноосвтняшкола3ступ2попльнянськажитомирськаобл
Житомирська область,село,Попільнянська селищна ОТГ,Строківська загальноосвітня школа І-ІІІ ступенів Попільянської селищної ради Житомирської області,I-III,,14,10,2,63,63,7,3478.3,3972.9,ні,6519000000,комунальна,15959,22057414,2019,18,22057414,строквськазагальноосвтняшкола3ступпопльянськажитомирськаобл
Житомирська область,село,Квітнева сільська ОТГ,Романівська загальноосвітня школа І-ІІІ ступенів ім. М.Т.Рильського,I-III,,21,10,5,123,123,11,4420.2,4650,ні,6527000000,комунальна,15957,22057390,2019,18,22057390,романвськазагальноосвтняшкола3ступменмтрильськог
Житомирська область,село,Краснопільська сільська ОТГ,"Краснопільська загальноосвітня школа І-ІІІ ступенів _x000D_
Краснопільської сільської ради Чуднівського району _x000D_
Житомирської області",I-III,,23,15,4,158,158,10,5391.7,5827.2,ні,6528000000,комунальна,16084,22067602,2019,18,22067602,краснопльськазагальноосвтняшкола3ступх000dкраснопльськах000dжитомирськаобл
Житомирська область,село,Семенівська сільська ОТГ,"Великонизгірецька загальноосвітня школа І-ІІІ ступенів,_x000D_
Семенівської сільської ради_x000D_
Житомирської області",I-III,,16,6,2,57,57,7,2623,2633.3,ні,6529000000,комунальна,16833,22054692,2019,18,22054692,великонизгрецьказагальноосвтняшкола3ступх000dсеменвськах000dжитомирськаобл
Житомирська область,село,Станишівська сільська ОТГ,Станишівська загальноосвітня школа І-ІІІ ступенів Житомирської району Житомипської області,I-III,,27,12,5,148,148,11,4619.9,6929.3,ні,6530000000,комунальна,16925,22060994,2019,18,22060994,станишвськазагальноосвтняшкола3ступжитомипськаобл
Житомирська область,село,Станишівська сільська ОТГ,Зарічанська загальноосвітня школа І-ІІ ступенів Житомирського району Житомирської області,I-III,,19,11,3,171,171,9,4812.9,5552.8,ні,6530000000,комунальна,16932,22060907,2019,18,22058922,зарчанськазагальноосвтняшкола2ступжитомирськаобл
Житомирська область,село,Любарська селищна ОТГ,Березівська загальноосвітня школа І-ІІІ ступенів Любарської селищної ради Любарського району Житомирської області,I-III,,19,14,3,86,86,9,3289.1,3609.2,ні,6534000000,комунальна,16748,22055912,2019,18,22055912,березвськазагальноосвтняшкола3ступлюбарськажитомирськаобл
Житомирська область,село,Любарська селищна ОТГ,Глезненська загально освітня школа І-ІІІ ступенів відділу освіти молоді та спорту Любарської селищної ради Житомирської області,I-III,,17,14,1,123,123,11,3655.4,4051.3,ні,6534000000,комунальна,16751,22055875,2019,18,22055875,глезненськазагальноосвтняшкола3ступвддлуосвтимолодтаспортулюбарськажитомирськаобл
Житомирська область,село,Брониківська сільська ОТГ,"Новороманівська загальноосвітня школа І-ІІІ ступенів_x000D_
Новоград-Волинського району Житомирської області",I-III,,27,18,4,199,199,11,7176.7,7790.3,ні,6535000000,комунальна,15738,06669810,2019,18,06669810,новороманвськазагальноосвтняшкола3ступх000dжитомирськаобл
Житомирська область,село,Овруцька міська ОТГ,"Опорний заклад освіти ""Бондарівський заклад загальної середньої освіти І-ІІІ ступенів""",I-III,,52,28,8,217,217,20,7809.2,8222.1,опорна,6538000000,комунальна,15889,06670598,2019,18,06670598,опорнийзакладосвтибондарвський3ступен
Житомирська область,село,Мартинівська сільська ОТГ,Мартинівська загальноосвітня школа І-ІІІ ступенів Мартинівської сільської ради Пулинського району Житомирської бласті,I-III,,22,12,1,157,157,11,4218.6,5020.3,ні,6540000000,комунальна,16041,22056886,2019,18,22056886,мартинвськазагальноосвтняшкола3ступмартинвськажитомирськабласт
Житомирська область,село,Соколівська сільська ОТГ,Соколівська загальноосвітня школа І-ІІІ ступенів Пулинського району Житомиської області,I-III,,18,10,8,95,95,11,3482.7,3563.7,ні,6541000000,комунальна,16044,22056811,2019,18,22056811,соколвськазагальноосвтняшкола3ступжитомиськаобл
Житомирська область,місто,Радомишльська міська ОТГ,Радомишльська загальноосвітня школа І-ІІІ ступенів № 5 ім. В. М. Чорновола Радомишльської міської ради,I-III,,32,17,4,354,354,16,7106.4,7054.9,ні,6543000000,комунальна,16948,20418799,2019,18,20418799,радомишльськазагальноосвтняшкола3ступ5менвмчорноволарадомишльськао
Житомирська область,село,Радомишльська міська ОТГ,Осичківська загальноосвітня школа І-ІІІ ступенів Радомишльської міської ради Житомирскьої області,I-III,,17,8,4,103,103,11,3302.1,3267.6,ні,6543000000,комунальна,16961,22057638,2019,18,22057638,осичквськазагальноосвтняшкола3ступрадомишльськажитомирскьаобл
Житомирська область,село,Вільшанська сільська ОТГ,Трощанська загальнооосвітня школа І-ІІІ ступеніів Чуднівської районної ради Житомирської області,I-III,,18,15,0,93,93,11,3632.218,4061.355,ні,6546000000,комунальна,16089,22054226,2019,18,22054226,трощанськазагальнооосвтняшкола3ступенвчуднвськажитомирськаобл
Житомирська область,місто,Житомирська міська ОТГ,ліцей №2 м. Житомира,I-III,,52,30,13,642,642,22,13562.4,14304.9,ні,6552000000,комунальна,15665,02143235,2019,18,22058974,лцей2мжитомир
Житомирська область,місто,Житомирська міська ОТГ,Загальноосвітня школа І-ІІІ ступенів №7 імені В.В. Бражевського,I-III,,89,37,22,1109,1109,40,23023.2,25076.6,ні,6552000000,комунальна,15669,22059005,2019,18,22059005,загальноосвтняшкола3ступ7менввбражевськог
Житомирська область,місто,Житомирська міська ОТГ,Загальноосвітня школа І - ІІІ ступенів № 19 м. Житомира Житомирської міської ради Житомирської області,I-III,,96,35,15,1290,1290,47,22026,24370.3,ні,6552000000,комунальна,15677,20427516,2019,18,20427516,загальноосвтняшкола3ступ19мжитомиражитомирськажитомирськаобл
Закарпатська область,місто,Мукачівська міська ОТГ,Мукачівський навчально-виховний комплекс „Загальноосвітня школа І-ІІІ ступенів-дошкільний навчальний заклад „Гармонія” Мукачівської міської ради Закарпатської області,I-III,,69,46,8,604,834,22,9090.2,7208.3,ні,7203100000,комунальна,19000,22112413,2019,21,22112413,мукачвськийнавчальновиховнийкомплексзагальноосвтняшкола3ступдошкльнийнавчальнийзакладгармоня”мукачвськазакарпатськаобл
Закарпатська область,місто,Мукачівська міська ОТГ,Мукачівський навчально-виховний комплекс „Загальноосвітня школа І-ІІІ ступенів - дошкільний навчальний заклад” №15 Мукачівської міської ради Закарпатської області,I-III,,29,26,5,122,192,7,7763,5661.7,ні,7203100000,комунальна,19003,40773391,2019,21,40773391,мукачвськийнавчальновиховнийкомплексзагальноосвтняшкола3ступдошкльнийнавчальнийзаклад”15мукачвськазакарпатськаобл
Закарпатська область,місто,Мукачівська міська ОТГ,Мукачівська спеціалізована школа І-ІІІ ступенів № 16 з поглиблем вивченням окремих предметів та курсів Мукачівської міської ради Закарпатської області,I-III,,47,17,4,630,630,24,11319.2,12337.928,ні,7203100000,комунальна,19013,22112515,2019,21,22112515,мукачвськаспецалзованашкола3ступ16зпоглиблемвивченямокремихпредметвтакурсвмукачвськазакарпатськаобл
Закарпатська область,місто,Мукачівська міська ОТГ,Мукачівська загальноосвітня школа І-ІІІ ступенів №1 ім. О.С. Пушкіна Мукачівської міської ради  Закарпатської області,I-III,,73,20,6,861,861,32,14007.6,15268.284000000001,ні,7203100000,комунальна,19004,22112372,2019,21,22112372,мукачвськазагальноосвтняшкола3ступ1меноспушкнамукачвськазакарпатськаобл
Закарпатська область,село,Мукачівський район,Дерценська загальноосвітня школа І-ІІІ ступенів з угорською мовою навчання Мукачівського району Закарпатської області,I-III,,28,16,0,265,265,11,6003.5,6733,ні,7307200000,комунальна,19078,34919686,2019,21,34919686,дерценськазагальноосвтняшкола3ступзугорськоюмовоюнавчанязакарпатськаобл
Закарпатська область,село,Великоберезнянський район,Лютянська загальноосвітня школа І-ІІІ Великоберезнянської районної ради Закарпатської області,I-III,,18,15,3,175,175,11,4888.3,5540.5,ні,7302200000,комунальна,18815,26326182,2019,21,26326182,лютянськазагальноосвтняшкола3великоберезнянськазакарпатськаобл
Закарпатська область,село,Виноградівський район,Великоком'ятівська загальноосвітня школа І-ІІІ ступенів Виноградівського районної ради Закарпатської області,I-III,,60,36,1,608,608,30,12706,14785.1,ні,7303200000,комунальна,18859,26213905,2019,21,26213905,великокомятвськазагальноосвтняшкола3ступвиноградвськогозакарпатськаобл
Закарпатська область,село,Виноградівський район,Чорнотисівська загальноосвітня школа І-ІІІ ступенів Виноградівської районної ради Закарпатської області,I-III,,36,19,5,257,257,17,7415.7,8943.1,ні,7303200000,комунальна,18874,38621185,2019,21,26213839,чорнотисвськазагальноосвтняшкола3ступвиноградвськазакарпатськаобл
Закарпатська область,село,Іршавський район,"Брідська загальноосвітня школа І-ІІІ ступенів_x000D_
Іршавської районної ради Закарпатської області",I-III,,44,14,0,385,385,18,6661.6,7624.2,ні,7305200000,комунальна,18945,22100009,2019,21,22100009,брдськазагальноосвтняшкола3ступх000dршавськазакарпатськаобл
Закарпатська область,село,Міжгірський район,Колочавська загальноосвітня школа І-ІІІ ступенів №1 Міжгірської районної ради Закаратської області,I-III,,59,35,9,445,445,26,13346.1,14300.8,ні,7306200000,комунальна,18990,25439369,2019,21,25439369,колочавськазагальноосвтняшкола3ступ1мжгрськазакаратськаобл
Закарпатська область,місто,Мукачівський район,Кольчинська загальноосвітня школа І-ІІІ ступнів Мукачівської районної ради Закарпатської області,I-III,,37,12,0,440,440,20,7888.2,9608.4,ні,7307200000,комунальна,19021,34919749,2019,21,34919749,кольчинськазагальноосвтняшкола3ступнвмукачвськазакарпатськаобл
Закарпатська область,село,Рахівський район,Косівсько-Полянська загальноосвітня школа І-ІІІ ступанів №1 Рахівської районної ради Закарпатської області,I-III,,56,25,6,419,419,21,13555.5,15474.5,ні,7309200000,комунальна,19120,26326319,2019,21,26326319,косвськополянськазагальноосвтняшкола3ступанв1рахвськазакарпатськаобл
Закарпатська область,село,Свалявський район,Березниківська загальноосвітня школа І-ІІІ ступенів Свлявської районної ради Закарпатської області,I-III,,52,13,7,375,375,20,8292.8,9100.1,ні,7310200000,комунальна,19160,26395898,2019,21,26395898,березниквськазагальноосвтняшкола3ступсвлявськазакарпатськаобл
Закарпатська область,село,Ужгородський район,Малогеєвецький навчально-виховний комплекс „Дошкільний навчальний заклад-загальноосвітня школа І-ІІІ ступенів” імені Ференца Егрі Ужгородської районної ради Закарпатської області,I-III,,24,17,1,111,132,11,4999.2,5422.1,ні,7312200000,комунальна,18723,38906251,2019,21,38906251,малогевецькийнавчальновиховнийкомплексдошкльнийнавчальнийзакладзагальноосвтняшкола3ступ”менференцаегружгородськазакарпатськаобл
