Рівненська область,місто,місто Рівне,Рівненська загальноосвітня школа І-ІІІ ступенів №22 Рівненської міської ради,16571,25675242,2019,56,22571269,рвненськазагальноосвтняшкола3ступ22рвненськао
Рівненська область,місто,місто Рівне,"Рівненський навчально-виховний комплекс «Загальноосвітня школа І-ІІІ ступенів - спеціалізована спортивна школа» №26 Рівненської міської ради_x000D_
",16575,25675242,2019,56,22564677,рвненськийнавчальновиховнийкомплексзагальноосвтняшкола3ступспецалзованаспортивнашкола26рвненськах000
Рівненська область,місто,місто Рівне,Рівненська загальноосвітня школа І-ІІІ ступенів №28 Рівненської міської ради,16577,25675242,2019,56,22565435,рвненськазагальноосвтняшкола3ступ28рвненськао
Рівненська область,місто,місто Рівне,"Рівненська гімназія ""Гармонія"" Рівненської міської ради",16579,25675242,2019,56,26009820,рвненськагмназягармонярвненськао
Рівненська область,місто,місто Рівне,Рівненський економіко-правовий ліцей Рівненської міської ради,16583,25675242,2019,56,22565346,рвненськийекономкоправовийлцейрвненськао
Рівненська область,село,Володимирецький район,"Заклад загальної середньої освіти ""Собіщицька загальноосвітня школа І-ІІІ ступенів, Володимирецької районної ради, Рівненської області""",2619,38462867,2019,56,22552912,собщицьказагальноосвтняшкола3ступволодимирецькарвненськаобл
Рівненська область,село,Володимирецький район,Великоцепцевицька загальноосвітня школа І-ІІІ ступенів Володимирецької районної ради,2633,22567960,2019,56,22567960,великоцепцевицьказагальноосвтняшкола3ступволодимирецькао
Рівненська область,село,Володимирецький район,"Городецький навчально-виховний комплекс ""Загальноосвітня школа І-ІІІ ступенів - дошкільний навчальний заклад"" Володимирецької районної ради_x000D_
Рівненської області",2650,22563784,2019,56,22563784,городецькийнавчальновиховнийкомплексзагальноосвтняшкола3ступдошкльнийнавчальнийзакладволодимирецьках000dрвненськаобл
Рівненська область,село,Гощанський район,"Томахівський навчальновиховний комплекс ""Загальноосвітня школа І-ІІІ ступенів - дошкільний навчальний заклад"" Гощанської районної ради Гощанського району Рівненської області _x000D_
",16168,22558101,2019,56,22558101,томахвськийнавчальновиховнийкомплексзагальноосвтняшкола3ступдошкльнийнавчальнийзакладгощанськарвненськаоблх000
Рівненська область,село,Демидівський район,"Вовковиївська загальноосвітня школа I-III ступенів Відділ освіти, молоді,спорту, культури та туризму Демидівської РДА Управління освіти Рівненської ОДА",16189,24177200,2019,56,24177200,вовковивськазагальноосвтняшкола3ступвддлосвтимолодспортукультуритатуризмудемидвськардауправлняосвтирвненськаод
Рівненська область,село,Дубенський район,Варковицька гімназія Дубенського району Рівненської області,16212,24169962,2019,56,24169962,варковицькагмназярвненськаобл
Рівненська область,село,Дубровицький район,"Бережницький НВК ""Загальноосвітня школа І-ІІІ ступенів-дошкільний навчальний заклад""",16263,39131530,2019,56,39131530,бережницькийнавчальновиховнийкомплексзагальноосвтняшкола3ступдошкльнийнавчальнийзакла
Рівненська область,село,Дубровицький район,"Залузький навчально-виховний коплекс (загальноосвітня школа І-ІІІ ступенів - дошкільний навчальний заклад), Дубровицької районної ради, Рівненської області.",16268,39134919,2019,56,39134919,залузькийнавчальновиховнийкоплексдубровицькарвненськаобл
Рівненська область,село,Дубровицький район,"Туменський навчально- виховний комплeкс ""Загальноосвітня школа І-ІІІ ступенів - дошкільний навчальний заклад"" Дубровицької районної ради Рівненської області",16281,25314068,2019,56,39135048,туменськийнавчальновиховнийкомплексзагальноосвтняшкола3ступдошкльнийнавчальнийзакладдубровицькарвненськаобл
Рівненська область,село,Дубровицький район,"Трипутнянський навчально-виховний комплекс ""загальноосвітня школа І-ІІІ ступенів - дошкільний навчальний заклад""",16282,39133040,2019,56,39133040,трипутнянськийнавчальновиховнийкомплексзагальноосвтняшкола3ступдошкльнийнавчальнийзакла
Рівненська область,село,Зарічненський район,Борівська загальноосвітня школа Зарічненської районної ради Рівненської області,16300,24173981,2019,56,24173981,борвськазагальноосвтняшколазарчненськарвненськаобл
Рівненська область,село,Зарічненський район,Вичівська загальноосвітня школа І-ІІІ ступенів,16301,24173998,2019,56,24173998,вичвськазагальноосвтняшкола3ступен
Рівненська область,село,Зарічненський район,Неньковицька загальноосвітня школа І - ІІІ ступенів,16312,24174213,2019,56,24174213,неньковицьказагальноосвтняшкола3ступен
Рівненська область,місто,Костопільський район,Костопільська загальньоосвітня школа І-ІІІ ступенів №5 Костопільської районної ради Рівненської області,16421,22564559,2019,56,22564559,костопльськазагальньоосвтняшкола3ступ5костопльськарвненськаобл
Рівненська область,село,Млинівський район,Підгаєцька загальногосвітня школа І-ІІІ ступенів Млинівської районної ради Рівненської області,16465,25318298,2019,56,25318298,пдгацьказагальногосвтняшкола3ступмлинвськарвненськаобл
Рівненська область,село,Острозький район,"Навчально-виховний комплекс ""Білашівська ЗОШ І-ІІІ ступенів - дитячий садок""_x000D_
Острозької районної ради Рівненської області",16488,34112246,2019,56,24176710,навчальновиховнийкомплексблашвськазагальноосвтняшкола3ступдитячийсадокх000dострозькарвненськаобл
Рівненська область,село,Рокитнівський район,Томашгородська загальноосвітня школа №2 І-ІІІ ступенів Рокитнівської районної ради Рівненської області,16664,25319272,2019,56,25319272,томашгородськазагальноосвтняшкола23ступрокитнвськарвненськаобл
Рівненська область,село,Рокитнівський район,"Хмільський заклад загальної середньої освіти І-ІІІ ступенів, Рокитнівського району, Рівненської області",16665,25319317,2019,56,25319317,хмльський3ступрвненськаобл
Рівненська область,село,Радивилівська міська ОТГ,Дружбівська загальноосвітня школа І-ІІІ ступенів Радивилівської міської ради Радивилівського раойну Рівненської області,16525,25320177,2019,56,25320177,дружбвськазагальноосвтняшкола3ступрадивилвськарадивилвськогораойнурвненськаобл
Рівненська область,село,Радивилівська міська ОТГ,Немирівська загальноосвітня школа І-ІІІ ступенів Радивилівської міської ради Радивилівського району Рівненської області,16529,25318625,2019,56,25318625,немирвськазагальноосвтняшкола3ступрадивилвськарвненськаобл
Рівненська область,місто,Радивилівська міська ОТГ,"Радивилівський навчально-виховний комплекс ""Загальноосвітня школа І-ІІІст. №1 - гімназія"" Радивилівської міської ради Радивилівського району Рівненської області",16534,25318105,2019,56,25318105,радивилвськийнавчальновиховнийкомплексзагальноосвтняшкола3ступ1гмназярадивилвськарвненськаобл
Рівненська область,місто,Радивилівська міська ОТГ,"Радивилівський навчально виховний комплекс ""Загальноосвітня школа І-ІІІ ступенів №2-ліцей"" ім. П.Г. Стрижака Радивилівської міської ради Радивилівського району Рівненської області",16535,38505512,2019,56,38505512,радивилвськийнавчальновиховнийкомплексзагальноосвтняшкола3ступ2лцейменпгстрижакарадивилвськарвненськаобл
Рівненська область,село,Висоцька сільська ОТГ,Висоцька загальноосвітня школа І-ІІІ ступенів Висоцької сільської ради,16267,25314076,2019,56,25314076,висоцьказагальноосвтняшкола3ступвисоцькао
Рівненська область,село,Боремельська сільська ОТГ,"Боремельський навчально-виховний комплекс ""загальноосвітня школа _x000D_
I-II ступенів-колегіум""",16187,24177186,2019,56,24177186,боремельськийнавчальновиховнийкомплексзагальноосвтняшколах000d2ступколегу
Рівненська область,село,Тараканівська сільська ОТГ,Тараканівський ліцей Тараканівської сільської ради,16227,24170830,2019,56,24170830,тараканвськийлцейтараканвськао
Рівненська область,місто,Клеванська селищна ОТГ,"Клеванський ліцей №2_x000D_
Клеванської селищної ради_x000D_
Рівненського району_x000D_
РівненськоЇ області",16603,25316788,2019,56,25316788,клеванськийлцей2х000dклеванськах000dрвненськогоух000dрвненськаобл
Рівненська область,село,Демидівська селищна ОТГ,Княгининський ліцей Демидівської селищної ради,16191,24177217,2019,56,24177217,княгининськийлцейдемидвськао
Рівненська область,село,Малолюбашанська сільська ОТГ,Мирненський ліцей Малолюбашанської сільської ради Костопільського районо Рівненської області,16426,13979876,2019,56,13979876,мирненськийлцеймалолюбашанськакостопльськогоорвненськаобл
Рівненська область,село,Старосільська сільська ОТГ,Вежицький заклад загальної середньої освітиІ-ІІІ ступенів Старосільської сільської ради Рокитнівського райоку Рівненської області,16648,39292899,2019,56,39292899,вежицький3ступстаророкитнвськогорайокурвненськаобл
Рівненська область,село,Старосільська сільська ОТГ,"Переходицький навчально-виховний комплекс ""загальноосвітній навчальний заклид І-ІІІ ступенів - дошкільний навчальний заклад""",16657,25319180,2019,56,25319180,переходицькийнавчальновиховнийкомплексзагальноосвтнйнавчальнийзаклид3ступдошкльнийнавчальнийзакла
Рівненська область,місто,Вараська міська ОТГ,Вараська загальноосвітня школа I-III ступенів №2 Вараської міської ради Рівненської області,16446,04590731,2019,56,33451143,вараськазагальноосвтняшкола3ступ2вараськарвненськаобл
Рівненська область,місто,Вараська міська ОТГ,"Вараська загальноосвiтня школа I-III ступенiв №5 Вараської мiської ради, Рiвненської областi",16449,04590731,2019,56,33351492,вараськазагальноосвтняшкола3ступ5вараськарвненськаобл
Рівненська область,місто,Вараська міська ОТГ,Вараська гімназія Вараської міської ради,16450,25737061,2019,56,25737061,вараськагмназявараськао
Сумська область,місто,місто Ромни,Роменська загальноосвітня школа I-III ступенів № 10 Роменської міської ради Сумської області,14652,02147919,2019,59,23054151,роменськазагальноосвтняшкола3ступ10роменськасумськаобл
Сумська область,село,Буринський район,"Дяківський навчально-виховний комплекс: загальноосвітня школа І-ІІІ ступенів, дошкільний навчальний заклад",14337,21127650,2019,59,21127650,дяквськийнавчальновиховнийкомплексзагальноосвтняшкола3ступдошкльнийнавчальнийзакла
Сумська область,село,Буринський район,Черепівська загальноосвітня школа І - ІІІ ступенів Черепівської сільської ради Буринського району Сумської області,14344,83126070,2019,59,33126070,черепвськазагальноосвтняшкола3ступчерепвськасумськаобл
Сумська область,село,Великописарівський район,Тарасівський навчально-виховний комплекс: загальноосвітня школа І-ІІІ ступенів - дошкільний навчальний заклад,14366,24012930,2019,59,25301292,тарасвськийнавчальновиховнийкомплексзагальноосвтняшкола3ступдошкльнийнавчальнийзакла
Сумська область,село,Глухівський район,"Кучерівський навчально - виховний комплекс: загальноосвітня школа І-ІІІ_x000D_
ступенів, дошкільний навчальний заклад «Полісяночка» _x000D_
 Глухівської районної ради Сумської області_x000D_
",14385,33141208,2019,59,33141208,кучервськийнавчальновиховнийкомплексзагальноосвтняшкола3х000dступдошкльнийнавчальнийзакладполсяночках000dглухвськасумськаоблх000
Сумська область,село,Глухівський район,"Суходільський навчально-виховний комплекс: загальноосвітня школа І-ІІІ ступенів, дошкільний навчальний заклад «Золотий ключик» Глухівської районної ради Сумської області",14394,02147730,2019,59,33095873,суходльськийнавчальновиховнийкомплексзагальноосвтняшкола3ступдошкльнийнавчальнийзакладзолотийключикглухвськасумськаобл
Сумська область,село,Охтирський район,Довжицький навачально-виховний комплекс: загальноосвітня школа І-ІІ ступенів - дошкільний навчальний заклад Охтирської районної ради Сумської області,14591,23053625,2019,59,23053625,довжицькийнавачальновиховнийкомплексзагальноосвтняшкола2ступдошкльнийнавчальнийзакладохтирськасумськаобл
Сумська область,місто,Путивльський район,Путивльська загальноосвітня школа І-ІІІ ступенів № 1 ім. Радіка Руднєва Путивльської районної ради Сумської області,14617,24011451,2019,59,24011451,путивльськазагальноосвтняшкола3ступ1менрадкаруднвапутивльськасумськаобл
Сумська область,місто,Путивльський район,Путивльська загальноосвітня школа І-ІІІ ступенів № 2 ім. Г.Я. Базими Путивльської районної ради Сумської області,14618,06711334,2019,59,06711334,путивльськазагальноосвтняшкола3ступ2менгябазимипутивльськасумськаобл
Сумська область,село,Роменський район,Дібровський навчально-виховний комплекс: загальноосвітня школа І-ІІІ ступенів-дошкільний навчальний заклад Роменської районної ради Сумської області,14674,23999408,2019,59,23999408,дбровськийнавчальновиховнийкомплексзагальноосвтняшкола3ступдошкльнийнавчальнийзакладроменськасумськаобл
Сумська область,місто,Кролевецька міська ОТГ,"Кролевецька загальноосвітня школа І-ІІІ ступенів № 2 імені М.О.Лукаша_x000D_
Кролевецької міської ради ",14481,24010888,2019,59,24010888,кролевецьказагальноосвтняшкола3ступ2менмолукашах000dкролевецькао
Сумська область,село,Білопільська міська ОТГ,Рижівський навчально-виховний комплекс: загальньоосвітня школа І-ІІІ ступенів - дошкільний навчальний заклад Білопільської міської ради Сумської області,14320,24021709,2019,59,24021709,рижвськийнавчальновиховнийкомплексзагальньоосвтняшкола3ступдошкльнийнавчальнийзакладблопльськасумськаобл
Тернопільська область,місто,місто Чортків,Чортківська загальноосвітня школа І-ІІІ ст. №2,18524,24618957,2019,61,24618957,чортквськазагальноосвтняшкола3ступ2
Тернопільська область,місто,місто Чортків,Чортківська загальньоосвітня школа I-III ступенів №5 Чортківської міської ради Тернопільської області,18526,24618963,2019,61,24618963,чортквськазагальньоосвтняшкола3ступ5чортквськатернопльськаобл
Тернопільська область,село,місто Чортків,Білівська загальноосвітня школа І-ІІІ ступенів,18512,24618851,2019,61,25940738,блвськазагальноосвтняшкола3ступен
Тернопільська область,село,Бережанський район,"Куропатницький навчально-виховний комплекс ""Загальноосвітній _x000D_
навчальний заклад І-ІІІ ступенів - дошкільний навчальний заклад"" _x000D_
_x000D_
",17752,24629346,2019,61,24629346,куропатницькийнавчальновиховнийкомплексзагальноосвтнйх000dнавчальнийзаклад3ступдошкльнийнавчальнийзакладх000dх000
Тернопільська область,місто,Бучацький район,"Бучацька загальноосвітня школа І-ІІІ ступенів №1, Бучацької районної ради, Тернопільської області",17851,24623295,2019,61,24623295,бучацьказагальноосвтняшкола3ступ1бучацькатернопльськаобл
Тернопільська область,місто,Бучацький район,Бучацький ліцей,17867,24623303,2019,61,44797264,бучацькийлце
Тернопільська область,село,Гусятинський район,Загальноосвітня школа І-ІІІ ступенів с. Раштівці,17925,23594717,2019,61,23594717,загальноосвтняшкола3ступсраштвц
Тернопільська область,село,Заліщицький район,Загальноосвітня школа I - III ступенів с. Садки Заліщицького району Тернопільської обл.,17969,24625213,2019,61,24625213,загальноосвтняшкола3ступссадкитернопльськаоб
